{"created_at":"2026-08-09T22:30:48Z","execution_commit":"e3476893d3337815026be09336b9a56cbe78659d","legacy_input_manifest_sha256":"f323c1c4e1940d03c2950d861ee243501825604593d9a9957b011e0d1f61740c","ordered_final_evidence":[{"repo_relative_path":"runs/phase12-filter-v5-rootless-qa/f3-state-locator.json","role":"f3-state-locator","sha256":"d4e960943748d9434332b81071bd9aee353cdb9bd28c8263632705419ea82bb4","size_bytes":360},{"repo_relative_path":"runs/phase12-filter-v5-rootless-qa/final/f1-plan-compliance.json","role":"final-f1-plan-compliance","sha256":"20bea29f9bcfcbf8182a8a3cd68c1f1e7d39f013701cd06aa63543083c321a53","size_bytes":654},{"repo_relative_path":"runs/phase12-filter-v5-rootless-qa/final/f2-broker-security.json","role":"final-f2-broker-security","sha256":"2fd803f40699f4e4a2baf66d19525043d08dabf8d2a79afb454fc3999d29a8d0","size_bytes":654},{"repo_relative_path":"runs/phase12-filter-v5-rootless-qa/final/f3-cli-rehearsal.json","role":"final-f3-cli-rehearsal","sha256":"6e6638013897167f2e2e87038ae68c42f589e6ccb974da7c02c9347003d4647f","size_bytes":1501},{"repo_relative_path":"runs/phase12-filter-v5-rootless-qa/final/f4-claim-scope-regression.json","role":"final-f4-claim-scope-regression","sha256":"1360f7833bcaa876c56723f1da4120687ff816977ca4929510c7a2727812806c","size_bytes":1986},{"repo_relative_path":"runs/phase12-filter-v5-rootless-qa/final/sentinels/f1-pytest.json","role":"network-sentinel-f1-pytest","sha256":"961d30cdc152c1e85af675f24c3282daf149af827f922f46dbb7517651b70e06","size_bytes":446},{"repo_relative_path":"runs/phase12-filter-v5-rootless-qa/final/sentinels/f2-pytest.json","role":"network-sentinel-f2-pytest","sha256":"2d573edb4dd4c32652a09563b6e198db369d46ef4050b3ad220e69580500a8a0","size_bytes":446},{"repo_relative_path":"runs/phase12-filter-v5-rootless-qa/final/sentinels/f3-pytest.json","role":"network-sentinel-f3-pytest","sha256":"c5fbdc18a2b75de177963b9487d54289ffca6556480946f3ad536e27e7c59449","size_bytes":446},{"repo_relative_path":"runs/phase12-filter-v5-rootless-qa/final/sentinels/f4-replay-pytest.json","role":"network-sentinel-f4-replay-pytest","sha256":"33a8b70393e1ba5fef7ac6ddb00bd8b6d9d4a394d6331c8b6059301251fde6dd","size_bytes":453},{"repo_relative_path":"runs/phase12-filter-v5-rootless-qa/final/sentinels/f4-rootless-pytest.json","role":"network-sentinel-f4-rootless-pytest","sha256":"75dcfcb05824289dec7e5f56ba84d70f66de623a450babb453a915b4a891ec2a","size_bytes":455},{"repo_relative_path":"runs/phase12-filter-v5-rootless-qa/final/sentinels/f4-ruff.json","role":"network-sentinel-f4-ruff","sha256":"b0e969c9482a75e8af0e3b08b977c426f88af2f1a3d99d438079803c4fc045c5","size_bytes":501},{"repo_relative_path":"runs/phase12-filter-v5-rootless-qa/final/sentinels/f4-validate-config.json","role":"network-sentinel-f4-validate-config","sha256":"b4ac52160e61aa4ecb5a69aa350e36b1b4bd87268ae922c9678b44a20a71b484","size_bytes":452},{"repo_relative_path":"runs/phase12-filter-v5-rootless-qa/t7-real-attempt.json","role":"t7-real-attempt","sha256":"7c5cb5b509e307a0b0eba72730953b4986d33351cc60a82a4fbae07eba4eee06","size_bytes":652},{"repo_relative_path":"runs/phase12-filter-v5-rootless-qa/pre-egress/zero-call-skip.json","role":"zero-call-skip","sha256":"da5b584083e331ada74a52406f304b1d06a111ca7c73d37c7e223ada46a306c3","size_bytes":505}],"ordered_pre_egress_evidence":[{"repo_relative_path":"runs/phase12-filter-v5-rootless-qa/pre-egress/execution-anchor.json","role":"execution-anchor","sha256":"da3d9abbb4235a274321768b3c130e9d681a57ceda49015677339b1826e9d0c9","size_bytes":157},{"repo_relative_path":"runs/phase12-filter-v5-rootless-qa/pre-egress/f1-plan-compliance.json","role":"pre-f1-plan-compliance","sha256":"4150c643c6a62e820a6df4a0a20efc3facc850bf24c0499fffde9926bff4a320","size_bytes":295},{"repo_relative_path":"runs/phase12-filter-v5-rootless-qa/pre-egress/f2-broker-security.json","role":"pre-f2-broker-security","sha256":"ffd1e4d96a31a67a36fbc4a5496d7df7ddde7da72157e3b246589299eed0d6a2","size_bytes":295},{"repo_relative_path":"runs/phase12-filter-v5-rootless-qa/pre-egress/f3-cli-rehearsal.json","role":"pre-f3-cli-rehearsal","sha256":"4ce3771bcb61be5c5c39838c0f10a090da5d0d2915fe421c29d67ea8977e863e","size_bytes":295}],"outcome":"zero_call_skip","plan_binding_sha256":"4444444444444444444444444444444444444444444444444444444444444444","profile":"local_rootless_non_authoritative","provider_calls_after":0,"provider_calls_before":0,"publication_receipt_sha256":null,"schema_version":"rootless_final_verification_index_v1","state_inventory_sha256":null,"zero_call_skip_sha256":"da5b584083e331ada74a52406f304b1d06a111ca7c73d37c7e223ada46a306c3"}
