{"created_at":"2026-08-09T20:00:12Z","execution_commit":"465431f4f3ea34a4de7451ca1bb31657b1b93454","legacy_input_manifest_sha256":"f323c1c4e1940d03c2950d861ee243501825604593d9a9957b011e0d1f61740c","ordered_final_evidence":[{"repo_relative_path":"runs/phase12-filter-v5-rootless-qa/f3-state-locator.json","role":"f3-state-locator","sha256":"0cd600fd6d1ae768bf40367178c66c6dee3bd644fb822e131fa99b69b3b9143d","size_bytes":360},{"repo_relative_path":"runs/phase12-filter-v5-rootless-qa/final/f1-plan-compliance.json","role":"final-f1-plan-compliance","sha256":"baa8b9a98bbc6ae5783950b97607295c2d1a8e77b25db5886048f2ebab907010","size_bytes":654},{"repo_relative_path":"runs/phase12-filter-v5-rootless-qa/final/f2-broker-security.json","role":"final-f2-broker-security","sha256":"8a9e118b5992bac0ad5a7668ad5d8edb918b394f849776d6a32eb1aafd8169eb","size_bytes":654},{"repo_relative_path":"runs/phase12-filter-v5-rootless-qa/final/f3-cli-rehearsal.json","role":"final-f3-cli-rehearsal","sha256":"9df790e98a2129b53d426d6462931650407ad2f5f7810a92c979ef288cd163c5","size_bytes":1501},{"repo_relative_path":"runs/phase12-filter-v5-rootless-qa/final/f4-claim-scope-regression.json","role":"final-f4-claim-scope-regression","sha256":"b8b4fe8b1f5f4bca11d5711971338d7d5a02b24f02968924e515301f7a5b7eea","size_bytes":1986},{"repo_relative_path":"runs/phase12-filter-v5-rootless-qa/final/sentinels/f1-pytest.json","role":"network-sentinel-f1-pytest","sha256":"778f29e03de313d6c89af5d434b723abda7877d790535ba82e7717af08865daa","size_bytes":446},{"repo_relative_path":"runs/phase12-filter-v5-rootless-qa/final/sentinels/f2-pytest.json","role":"network-sentinel-f2-pytest","sha256":"39b00ef69a26576a4f8c46959f18dae2b822959f20859da0377ab5dac58a35f9","size_bytes":446},{"repo_relative_path":"runs/phase12-filter-v5-rootless-qa/final/sentinels/f3-pytest.json","role":"network-sentinel-f3-pytest","sha256":"823578bb846d6ea17d49e0f67ebbde1ffd92081e3b0305f200b305bddd9fb65a","size_bytes":446},{"repo_relative_path":"runs/phase12-filter-v5-rootless-qa/final/sentinels/f4-replay-pytest.json","role":"network-sentinel-f4-replay-pytest","sha256":"1fd46f3941e31de641b0d94485c36932429eaf3aba233388a2153d21627780a3","size_bytes":453},{"repo_relative_path":"runs/phase12-filter-v5-rootless-qa/final/sentinels/f4-rootless-pytest.json","role":"network-sentinel-f4-rootless-pytest","sha256":"da85a27c5aff39b5ae6d17a3ecbf9976ea64a99d9d87015f54a79ba199b6a8d4","size_bytes":455},{"repo_relative_path":"runs/phase12-filter-v5-rootless-qa/final/sentinels/f4-ruff.json","role":"network-sentinel-f4-ruff","sha256":"d03a3e36f0be3f9207d1fb9a9566831f19c358c25f350111e9d8ad6be56015e3","size_bytes":501},{"repo_relative_path":"runs/phase12-filter-v5-rootless-qa/final/sentinels/f4-validate-config.json","role":"network-sentinel-f4-validate-config","sha256":"be06c936896283cd83037c5edd2b812aba61657a23461793adc59a19564fe639","size_bytes":452},{"repo_relative_path":"runs/phase12-filter-v5-rootless-qa/t7-real-attempt.json","role":"t7-real-attempt","sha256":"dd20ca6a1c080d9f68865c5bd0a3074a2fc4c966ac03914bcf6dd9f3dea3ddab","size_bytes":652},{"repo_relative_path":"runs/phase12-filter-v5-rootless-qa/pre-egress/zero-call-skip.json","role":"zero-call-skip","sha256":"cb4cf93efa9f69ce032390fc277b78b8d3ae61e724ba717d3324a88c17949cb0","size_bytes":505}],"ordered_pre_egress_evidence":[{"repo_relative_path":"runs/phase12-filter-v5-rootless-qa/pre-egress/execution-anchor.json","role":"execution-anchor","sha256":"2934256aa9d676c7c51a082d7336aa984ac3b2cce59ab3812e384a71d73c1652","size_bytes":157}],"outcome":"zero_call_skip","plan_binding_sha256":"4444444444444444444444444444444444444444444444444444444444444444","profile":"local_rootless_non_authoritative","provider_calls_after":0,"provider_calls_before":0,"publication_receipt_sha256":null,"schema_version":"rootless_final_verification_index_v1","state_inventory_sha256":null,"zero_call_skip_sha256":"cb4cf93efa9f69ce032390fc277b78b8d3ae61e724ba717d3324a88c17949cb0"}
